[
  {
    "src": "GENERAL DYNAMICS LAND SYSTEMS",
    "rel": "owned_by",
    "dst": "GENERAL DYNAMICS",
    "date": "",
    "ref": "GLEIF 875500ULXB4CYQSJVA03 → 9C1X8XOOTYY2FNYTVH06",
    "source": "data/reference/gleif/lei-records.yaml",
    "relation_class": null,
    "relation_basis": null
  },
  {
    "src": "DANA LIGHT AXLE PRODUCTS",
    "rel": "owned_by",
    "dst": "DANA INCORPORATED",
    "date": "",
    "ref": "RSEI parent / GLEIF KVWHW7YLZPFJM8QYNJ51",
    "source": "data/reference/rsei/inventory.yaml",
    "relation_class": null,
    "relation_basis": null
  }
]
