[
  {
    "src": "KYLE BRENNEMAN",
    "rel": "trustee_of",
    "dst": "KYLE BRENNEMAN LIVING",
    "date": "",
    "ref": "",
    "source": "recorder/202508130008300.deed.yaml",
    "relation_class": null,
    "relation_basis": null
  },
  {
    "src": "SARAH BRENNEMAN",
    "rel": "trustee_of",
    "dst": "KYLE BRENNEMAN LIVING",
    "date": "",
    "ref": "",
    "source": "recorder/202508130008300.deed.yaml",
    "relation_class": null,
    "relation_basis": null
  },
  {
    "src": "KYLE BRENNEMAN LIVING",
    "rel": "conveyed_to",
    "dst": "BISTROZZI",
    "date": "2025-08-13",
    "ref": "202508130008300",
    "source": "recorder/202508130008300.deed.yaml",
    "relation_class": null,
    "relation_basis": null
  },
  {
    "src": "KEATON BRENNEMAN",
    "rel": "trustee_of",
    "dst": "KEATON BRENNEMAN LIVING",
    "date": "",
    "ref": "",
    "source": "recorder/202508130008300.deed.yaml",
    "relation_class": null,
    "relation_basis": null
  },
  {
    "src": "KRISTEN BRENNEMAN",
    "rel": "trustee_of",
    "dst": "KEATON BRENNEMAN LIVING",
    "date": "",
    "ref": "",
    "source": "recorder/202508130008300.deed.yaml",
    "relation_class": null,
    "relation_basis": null
  }
]
