[
  {
    "src": "CITY OF WAPAKONETA",
    "rel": "operates",
    "dst": "npdes:2PD00019",
    "date": "",
    "ref": "2PD00019*SD",
    "source": "oepa/wapakoneta/2PD00019.fs.npdes.yaml",
    "relation_class": null,
    "relation_basis": null
  },
  {
    "src": "npdes:2PD00019",
    "rel": "discharges_to",
    "dst": "AUGLAIZE RIVER",
    "date": "",
    "ref": "2PD00019*SD",
    "source": "oepa/wapakoneta/2PD00019.fs.npdes.yaml",
    "relation_class": null,
    "relation_basis": null
  },
  {
    "src": "GENERAL DYNAMICS LAND SYSTEMS",
    "rel": "owned_by",
    "dst": "GENERAL DYNAMICS",
    "date": "",
    "ref": "GLEIF 875500ULXB4CYQSJVA03 → 9C1X8XOOTYY2FNYTVH06",
    "source": "data/reference/gleif/lei-records.yaml",
    "relation_class": null,
    "relation_basis": null
  }
]
